<?xml version="1.0" encoding="UTF-8"?>
<dataroot xmlns:od="urn:schemas-microsoft-com:officedata" xmlns:xsi="http://www.w3.org/2001/XMLSchema-instance"  xsi:noNamespaceSchemaLocation="aeItems.xsd" generated="2016-11-26T21:05:02">
<aeItems>
<Item>Cofee</Item>
<Quantity>100</Quantity>
<Status>Levels Low</Status>
<CHK>0</CHK>
</aeItems>
<aeItems>
<Item>Soda</Item>
<Quantity>49</Quantity>
<Status>Order Now!</Status>
<CHK>0</CHK>
</aeItems>
<aeItems>
<Item>Tea</Item>
<Quantity>101</Quantity>
<CHK>0</CHK>
</aeItems>
<aeItems>
<Item>Water</Item>
<Quantity>0</Quantity>
<CHK>0</CHK>
</aeItems>
</dataroot>
